name,price,link
Кресло Пайл Barhat Olive,25 990,https://www.divan.ru/product/kreslo-pajl-barhat-olive
Кресло Нелви Cozy Terra,26 990,https://www.divan.ru/product/kreslo-nelvi-cozy-terra
Кресло Орхет Velvet Terra,17 990,https://www.divan.ru/product/kreslo-orhet-velvet-terra
Кресло Кальдера Bucle Cloud,36 990,https://www.divan.ru/product/kreslo-kaldera-bucle-cloud
Кресло поворотное Кессен Velvet Olive,24 990,https://www.divan.ru/product/kreslo-povorotnoe-kessen-velvet-olive
Кресло Данго Bucle Beige,46 990,https://www.divan.ru/product/kreslo-dango-bucle-beige
Кресло Ланси Wool Pink,12 990,https://www.divan.ru/product/kreslo-lansi-wool-pink
Кресло-кровать Кейсес Velvet Olive,24 990,https://www.divan.ru/product/kreslo-krovat-kejses-velvet-olive
Кресло Ансил Barhat Caramel,24 990,https://www.divan.ru/product/kreslo-ansil-barhat-caramel
Кресло Лонди Bucle Smoky,43 990,https://www.divan.ru/product/kreslo-londi-bucle-smoky
Кресло Кенсол Barhat Olive,19 990,https://www.divan.ru/product/kreslo-kensol-barhat-olive
Кресло Бринт Soft Light,17 990,https://www.divan.ru/product/kreslo-brint-soft-light
Кресло Пайпел-2 Bucle Forest,42 990,https://www.divan.ru/product/kreslo-pajpel-2-bucle-forest
Кресло-кровать Види Textile Grey,22 990,https://www.divan.ru/product/kreslo-krovat-vidi-textile-grey
Кресло Тут Рядом Мечта Серо-графитовое,19 990,https://www.divan.ru/product/kreslo-tut-ryadom-mechta-sero-grafitovoe
Кресло поворотное Теоп Bucle White,37 990,https://www.divan.ru/product/kreslo-povorotnoe-teop-bucle-white
Кресло Ланси Wool Yellow,12 990,https://www.divan.ru/product/kreslo-lansi-wool-yellow
Кресло-кровать Слипсон Мини Linia Lavender,34 990,https://www.divan.ru/product/kreslo-krovat-slipson-mini-linia-lavender
Кресло-кровать Льери Мини Velvet Coral,38 990,https://www.divan.ru/product/kreslo-krovat-leri-mini-velvet-coral
Кресло Грейн Textile Olive,12 990,https://www.divan.ru/product/kreslo-grejn-textile-olive
Кресло-кровать Нумо Мини Textile Light,21 990,https://www.divan.ru/product/kreslo-krovat-numo-mini-textile-light
Кресло Винси Textile Ginger,21 990,https://www.divan.ru/product/kreslo-vinsi-textile-ginger
Кресло Дженкс Textile Blue,20 990,https://www.divan.ru/product/kreslo-djenks-textile-blue
Кресло-кровать Ольен Мини Velvet Latte,31 990,https://www.divan.ru/product/kreslo-krovat-olen-mini-velvet-latte
Кресло Мисл Barhat Beige,39 990,https://www.divan.ru/product/kreslo-misl-barhat-beige
Кресло Пайпел-2 Bucle Yellow,42 990,https://www.divan.ru/product/kreslo-pajpel-2-bucle-yellow
Кресло Тут Рядом Космос-1 Зеленый,72 990,https://www.divan.ru/product/kreslo-tut-ryadom-kosmos-1-zelenyj
Кресло Роттердам Velvet Violet,20 990,https://www.divan.ru/product/kreslo-rotterdam-velvet-violet
Кресло Носта Barhat Silver,22 990,https://www.divan.ru/product/kreslo-nosta-barhat-silver
Кресло Бонс-Т Velvet Emerald,31 990,https://www.divan.ru/product/kreslo-bons-t-velvet-emerald
Кресло Виль Barhat Beige,29 990,https://www.divan.ru/product/kreslo-vil-barhat-beige
Кресло-кровать Динс Мини Velvet Coral,32 990,https://www.divan.ru/product/kreslo-krovat-dins-mini-velvet-coral
Кресло-кровать Эби Мини Linia Navy,35 990,https://www.divan.ru/product/kreslo-krovat-abi-mini-linia-navy
Кресло Гарди Soft Toffe,26 990,https://www.divan.ru/product/kreslo-gardi-soft-toffe
Кресло-кровать Маре Мини Velvet Ginger,23 990,https://www.divan.ru/product/kreslo-krovat-mare-mini-velvet-ginger
Кресло-кровать Лесли Velvet Sand,36 990,https://www.divan.ru/product/kreslo-krovat-lesli-velvet-sand
Кресло Пайпел Bucle Forest,28 990,https://www.divan.ru/product/kreslo-pajpel-bucle-forest
Кресло Ларни Velvet Coral,23 990,https://www.divan.ru/product/kreslo-larni-velvet-coral
Кресло Brera Velour Lilac,68 990,https://www.divan.ru/product/kreslo-brera-velour-lilac
Кресло Оденс Linia Nut,21 990,https://www.divan.ru/product/kreslo-odens-linia-nut
Кресло Роттердам Cozy Milk,21 990,https://www.divan.ru/product/kreslo-rotterdam-cozy-milk
Кресло Кальдера Barhat Navy Blue,34 990,https://www.divan.ru/product/kreslo-kaldera-barhat-navy-blue
Кресло-кровать Лесли Velvet Mint,36 990,https://www.divan.ru/product/kreslo-krovat-lesli-velvet-mint
Кресло Маркфул Velvet Grey,26 990,https://www.divan.ru/product/kreslo-markful-velvet-grey
Кресло-кровать Льери Мини Velvet Yellow,38 990,https://www.divan.ru/product/kreslo-krovat-leri-mini-velvet-yellow
Кресло Данго Bucle Grafit,46 990,https://www.divan.ru/product/kreslo-dango-bucle-grafit
Кресло Коренс Happy Grey,24 990,https://www.divan.ru/product/kreslo-korens-happy-grey
Кресло Боско Land Forest,36 990,https://www.divan.ru/product/kreslo-bosko-land-forest
